<?xml version="1.0" encoding="UTF-8"?>
<!--
Click nbfs://nbhost/SystemFileSystem/Templates/Licenses/license-default.txt to change this license
Click nbfs://nbhost/SystemFileSystem/Templates/XML/emptyDTD.dtd to edit this template
-->

<!--
    TODO define vocabulary identification data
    PUBLIC ID  : -//vendor//vocabulary//EN
    SYSTEM ID  : http://server/path/__NAME__
-->

<!-- TODO define your own vocabulary/syntax. Example follows:  -->
<!ELEMENT Houses (house*)> <!-- ? :0 hoặc 1, * :0 hoặc nhiếu, + :1 hoặc nhiều -->
<!ELEMENT house (room+)>
<!ELEMENT room  (dimensions, windows, furniture*)>
<!ELEMENT dimensions (width, length)>
<!ELEMENT windows (window*)>
<!ELEMENT window  (elevation, width, height)>
<!ELEMENT furniture (#PCDATA)>
<!ELEMENT width (#PCDATA)>
<!ELEMENT length (#PCDATA)>
<!ELEMENT height (#PCDATA)>
<!ELEMENT elevation EMPTY>
<!ATTLIST  room name  ID #REQUIRED
            colour IDREF #IMPLIED>
<!ATTLIST  elevation facing(north | south | east | west) #REQUIRED>
